{
  "protocol_version": "0.1.0",
  "status": "within_budget",
  "summary": {
    "total_items": 55,
    "within_budget": 55,
    "warnings": 0,
    "over_budget": 0,
    "missing": 0
  },
  "items": [
    {
      "budget_class": "instruction_index",
      "path": "AGENTS.md",
      "status": "within_budget",
      "bytes": 1389,
      "lines": 28,
      "estimated_tokens": 348,
      "target": 16384,
      "warning": 32768,
      "metric": "bytes",
      "notes": []
    },
    {
      "budget_class": "instruction_index",
      "path": "CLAUDE.md",
      "status": "within_budget",
      "bytes": 1389,
      "lines": 28,
      "estimated_tokens": 348,
      "target": 16384,
      "warning": 32768,
      "metric": "bytes",
      "notes": []
    },
    {
      "budget_class": "instruction_index",
      "path": "GEMINI.md",
      "status": "within_budget",
      "bytes": 1389,
      "lines": 28,
      "estimated_tokens": 348,
      "target": 16384,
      "warning": 32768,
      "metric": "bytes",
      "notes": []
    },
    {
      "budget_class": "instruction_index",
      "path": ".cursor/rules/meta-harness.mdc",
      "status": "within_budget",
      "bytes": 1547,
      "lines": 35,
      "estimated_tokens": 387,
      "target": 16384,
      "warning": 32768,
      "metric": "bytes",
      "notes": []
    },
    {
      "budget_class": "instruction_index",
      "path": ".github/copilot-instructions.md",
      "status": "within_budget",
      "bytes": 1501,
      "lines": 30,
      "estimated_tokens": 376,
      "target": 16384,
      "warning": 32768,
      "metric": "bytes",
      "notes": []
    },
    {
      "budget_class": "instruction_index",
      "path": ".github/instructions/meta-harness.instructions.md",
      "status": "within_budget",
      "bytes": 1520,
      "lines": 34,
      "estimated_tokens": 380,
      "target": 16384,
      "warning": 32768,
      "metric": "bytes",
      "notes": []
    },
    {
      "budget_class": "instruction_index",
      "path": ".windsurf/rules/meta-harness.md",
      "status": "within_budget",
      "bytes": 1481,
      "lines": 30,
      "estimated_tokens": 371,
      "target": 16384,
      "warning": 32768,
      "metric": "bytes",
      "notes": []
    },
    {
      "budget_class": "instruction_index",
      "path": ".continue/rules/meta-harness.md",
      "status": "within_budget",
      "bytes": 1486,
      "lines": 30,
      "estimated_tokens": 372,
      "target": 16384,
      "warning": 32768,
      "metric": "bytes",
      "notes": []
    },
    {
      "budget_class": "instruction_index",
      "path": ".opencode/instructions/meta-harness.md",
      "status": "within_budget",
      "bytes": 1480,
      "lines": 30,
      "estimated_tokens": 370,
      "target": 16384,
      "warning": 32768,
      "metric": "bytes",
      "notes": []
    },
    {
      "budget_class": "instruction_index",
      "path": ".roo/rules/meta-harness.md",
      "status": "within_budget",
      "bytes": 1485,
      "lines": 30,
      "estimated_tokens": 372,
      "target": 16384,
      "warning": 32768,
      "metric": "bytes",
      "notes": []
    },
    {
      "budget_class": "skill_body",
      "path": "skills/meta-harness/SKILL.md",
      "status": "within_budget",
      "bytes": 2118,
      "lines": 54,
      "estimated_tokens": 530,
      "target": 5000,
      "warning": 6000,
      "metric": "tokens",
      "notes": []
    },
    {
      "budget_class": "skill_metadata",
      "path": "skills/meta-harness/SKILL.md",
      "label": "metadata",
      "status": "within_budget",
      "bytes": 239,
      "lines": 6,
      "estimated_tokens": 60,
      "target": 100,
      "warning": 150,
      "metric": "tokens",
      "notes": []
    },
    {
      "budget_class": "skill_body",
      "path": ".agents/skills/meta-harness/SKILL.md",
      "status": "within_budget",
      "bytes": 1570,
      "lines": 34,
      "estimated_tokens": 393,
      "target": 5000,
      "warning": 6000,
      "metric": "tokens",
      "notes": []
    },
    {
      "budget_class": "skill_metadata",
      "path": ".agents/skills/meta-harness/SKILL.md",
      "label": "metadata",
      "status": "within_budget",
      "bytes": 288,
      "lines": 9,
      "estimated_tokens": 72,
      "target": 100,
      "warning": 150,
      "metric": "tokens",
      "notes": []
    },
    {
      "budget_class": "skill_body",
      "path": ".claude/skills/meta-harness/SKILL.md",
      "status": "within_budget",
      "bytes": 1010,
      "lines": 21,
      "estimated_tokens": 253,
      "target": 5000,
      "warning": 6000,
      "metric": "tokens",
      "notes": []
    },
    {
      "budget_class": "skill_metadata",
      "path": ".claude/skills/meta-harness/SKILL.md",
      "label": "metadata",
      "status": "within_budget",
      "bytes": 279,
      "lines": 9,
      "estimated_tokens": 70,
      "target": 100,
      "warning": 150,
      "metric": "tokens",
      "notes": []
    },
    {
      "budget_class": "mcp_instructions",
      "path": "packages/mcp-server/src/server.ts",
      "label": "description_1",
      "status": "within_budget",
      "bytes": 41,
      "lines": 1,
      "estimated_tokens": 11,
      "target": 512,
      "warning": 512,
      "metric": "chars",
      "notes": ["Each MCP tool description must fit in a compact host-visible description."]
    },
    {
      "budget_class": "mcp_instructions",
      "path": "packages/mcp-server/src/server.ts",
      "label": "description_2",
      "status": "within_budget",
      "bytes": 30,
      "lines": 1,
      "estimated_tokens": 8,
      "target": 512,
      "warning": 512,
      "metric": "chars",
      "notes": ["Each MCP tool description must fit in a compact host-visible description."]
    },
    {
      "budget_class": "mcp_instructions",
      "path": "packages/mcp-server/src/server.ts",
      "label": "description_3",
      "status": "within_budget",
      "bytes": 42,
      "lines": 1,
      "estimated_tokens": 11,
      "target": 512,
      "warning": 512,
      "metric": "chars",
      "notes": ["Each MCP tool description must fit in a compact host-visible description."]
    },
    {
      "budget_class": "mcp_instructions",
      "path": "packages/mcp-server/src/server.ts",
      "label": "description_4",
      "status": "within_budget",
      "bytes": 34,
      "lines": 1,
      "estimated_tokens": 9,
      "target": 512,
      "warning": 512,
      "metric": "chars",
      "notes": ["Each MCP tool description must fit in a compact host-visible description."]
    },
    {
      "budget_class": "mcp_instructions",
      "path": "packages/mcp-server/src/server.ts",
      "label": "description_5",
      "status": "within_budget",
      "bytes": 28,
      "lines": 1,
      "estimated_tokens": 7,
      "target": 512,
      "warning": 512,
      "metric": "chars",
      "notes": ["Each MCP tool description must fit in a compact host-visible description."]
    },
    {
      "budget_class": "mcp_instructions",
      "path": "packages/mcp-server/src/server.ts",
      "label": "description_6",
      "status": "within_budget",
      "bytes": 43,
      "lines": 1,
      "estimated_tokens": 11,
      "target": 512,
      "warning": 512,
      "metric": "chars",
      "notes": ["Each MCP tool description must fit in a compact host-visible description."]
    },
    {
      "budget_class": "mcp_instructions",
      "path": "packages/mcp-server/src/server.ts",
      "label": "description_7",
      "status": "within_budget",
      "bytes": 48,
      "lines": 1,
      "estimated_tokens": 12,
      "target": 512,
      "warning": 512,
      "metric": "chars",
      "notes": ["Each MCP tool description must fit in a compact host-visible description."]
    },
    {
      "budget_class": "mcp_instructions",
      "path": "packages/mcp-server/src/server.ts",
      "label": "description_8",
      "status": "within_budget",
      "bytes": 41,
      "lines": 1,
      "estimated_tokens": 11,
      "target": 512,
      "warning": 512,
      "metric": "chars",
      "notes": ["Each MCP tool description must fit in a compact host-visible description."]
    },
    {
      "budget_class": "mcp_instructions",
      "path": "packages/mcp-server/src/server.ts",
      "label": "description_9",
      "status": "within_budget",
      "bytes": 45,
      "lines": 1,
      "estimated_tokens": 12,
      "target": 512,
      "warning": 512,
      "metric": "chars",
      "notes": ["Each MCP tool description must fit in a compact host-visible description."]
    },
    {
      "budget_class": "mcp_instructions",
      "path": "packages/mcp-server/src/server.ts",
      "label": "description_10",
      "status": "within_budget",
      "bytes": 61,
      "lines": 1,
      "estimated_tokens": 16,
      "target": 512,
      "warning": 512,
      "metric": "chars",
      "notes": ["Each MCP tool description must fit in a compact host-visible description."]
    },
    {
      "budget_class": "mcp_instructions",
      "path": "packages/mcp-server/src/server.ts",
      "label": "description_11",
      "status": "within_budget",
      "bytes": 42,
      "lines": 1,
      "estimated_tokens": 11,
      "target": 512,
      "warning": 512,
      "metric": "chars",
      "notes": ["Each MCP tool description must fit in a compact host-visible description."]
    },
    {
      "budget_class": "mcp_instructions",
      "path": "packages/mcp-server/src/server.ts",
      "label": "description_12",
      "status": "within_budget",
      "bytes": 42,
      "lines": 1,
      "estimated_tokens": 11,
      "target": 512,
      "warning": 512,
      "metric": "chars",
      "notes": ["Each MCP tool description must fit in a compact host-visible description."]
    },
    {
      "budget_class": "mcp_instructions",
      "path": "packages/mcp-server/src/server.ts",
      "label": "description_13",
      "status": "within_budget",
      "bytes": 39,
      "lines": 1,